<target name="Spring service"
xmlns="http://minuteproject.sf.net/xsd/mp-template-config" 
xmlns:xs="http://www.w3.org/2001/XMLSchema-instance" 
xs:schemaLocation="./mp-template-config.xsd">
	<architecture-target name="Spring service" description="Spring service architecture">
	</architecture-target>	

	<template-target 
    	name="Spring data"
		libdir="lib/SPRING_LIB.vm"
		outputdir="src/main/java"
		belongToPackage="true">
		<property name="DomainEntityUMLTemplate" value="DomainEntityJPA2Annotation" />

		<template name="SpringDataModelRepository" templateFileName="SpringDataModelRepository.vm" 
			outputsubdir="" technicalPackage="repository"
			file-extension="java" file-prefix="" file-suffix="Repository" 
			model-specific="true"
			has-updatable-nature="true">
		</template>	

		<template name="SpringDataEntityRepository" templateFileName="SpringDataEntityRepository.vm" 
			outputsubdir="" technicalPackage="repository"
			file-extension="java" file-prefix="" file-suffix="Repository" 
			entity-specific="true"
			check-template-to-generate="true" is-template-to-generate-method="enrichmentUtils.isToGenerateBasedOnNotMany2Many"
			has-updatable-nature="true">
		</template>	

	</template-target>

    <template-target 
        name="Spring data"
        libdir="lib/SPRING_LIB.vm"
        outputdir=""
        package-root="">

        <template name="PomXml.springdata" templateFileName="PomXml.springdata.vm" 
            subdir="" outputsubdir="" technicalPackage="" has-updatable-nature="true"
            file-extension="xml" file-prefix="pom" file-suffix="" 
            application-specific="true" add-model-name="false">
        </template> 
                    
    </template-target>      
                    
</target>
